{
  "name": "Glass Bells",
  "tags": ["keys"],
  "note": "C5",
  "waveform": {
    "type": "sine",
    "count": 1,
    "detune": 0
  },
  "filter": {
    "type": "lowpass",
    "frequency": 8000,
    "resonance": 0
  },
  "ampEnvelope": {
    "attack": 0.01,
    "decay": 1.5,
    "sustain": 0,
    "release": 0.5
  },
  "filterEnvelope": {
    "amount": 0,
    "attack": 0,
    "decay": 0,
    "sustain": 0,
    "release": 0
  },
  "noise": {
    "type": "white",
    "mix": 0
  },
  "pitch": {
    "amount": 0,
    "attack": 0,
    "decay": 0,
    "sustain": 0,
    "release": 0
  },
  "fm": {
    "ratio": 3.5,
    "index": 12,
    "attack": 0.01,
    "decay": 1.2,
    "sustain": 0,
    "release": 0.5
  }
}
