{
  "name": "Kick Drum",
  "tags": ["drum"],
  "note": "C2",
  "waveform": {
    "type": "sine",
    "count": 1,
    "detune": 0
  },
  "filter": {
    "type": "lowpass",
    "frequency": 200,
    "resonance": 0
  },
  "ampEnvelope": {
    "attack": 0.01,
    "decay": 0.3,
    "sustain": 0,
    "release": 0.1
  },
  "filterEnvelope": {
    "amount": 0,
    "attack": 0,
    "decay": 0,
    "sustain": 0,
    "release": 0
  },
  "noise": {
    "type": "white",
    "mix": 0
  },
  "pitch": {
    "amount": 24,
    "attack": 0,
    "decay": 0.08,
    "sustain": 0,
    "release": 0
  },
  "fm": {
    "ratio": 1,
    "index": 0,
    "attack": 0,
    "decay": 0,
    "sustain": 0,
    "release": 0
  }
}
