{
  "name": "Snare Drum",
  "tags": ["drum"],
  "note": "C3",
  "waveform": {
    "type": "triangle",
    "count": 1,
    "detune": 0
  },
  "filter": {
    "type": "highpass",
    "frequency": 200,
    "resonance": 0
  },
  "ampEnvelope": {
    "attack": 0.01,
    "decay": 0.15,
    "sustain": 0,
    "release": 0.1
  },
  "filterEnvelope": {
    "amount": 0,
    "attack": 0,
    "decay": 0,
    "sustain": 0,
    "release": 0
  },
  "noise": {
    "type": "white",
    "mix": 0.6
  },
  "pitch": {
    "amount": 12,
    "attack": 0,
    "decay": 0.05,
    "sustain": 0,
    "release": 0
  },
  "fm": {
    "ratio": 1,
    "index": 0,
    "attack": 0,
    "decay": 0,
    "sustain": 0,
    "release": 0
  }
}
